### ISSUE TITLE
When different MSS among the subflows,the TCP fragment is bad behaviour

### ISSUE THREAD

**Issue by ak47for** [multipath-tcp/mptcp#87]
We test MPTCP with v0.89,and the MSS of the subflow is different,one is 1394,another is 1400.
And,with this test enviroment,the fragment of TCP is 1362 and 6.

Below is the wireshark log analysis:

//one of MSS is 1394
139 2015-07-13 03:04:12.389544000   10.96.89.180    219.141.250.152 TCP 88      Multipath Capable   37253 > rfe [SYN] Seq=0 Win=29200 Len=0 MSS=1460 SACK_PERM=1 TSval=1836255 TSecr=0 WS=128
140 2015-07-13 03:04:12.423282000   219.141.250.152 10.96.89.180    TCP 88      Multipath Capable   rfe > 37253 [SYN, ACK] Seq=0 Ack=1 Win=28560 Len=0 MSS=1394 SACK_PERM=1 TSval=492362 TSecr=1836255 WS=128

//another MSS is 1400
170 2015-07-13 03:04:12.463330000   10.24.148.206   219.141.250.152 TCP 88      Join Connection 41686 > rfe [SYN] Seq=0 Win=29200 Len=0 MSS=1460 SACK_PERM=1 TSval=1836274 TSecr=0 WS=128
172 2015-07-13 03:04:12.590146000   219.141.250.152 10.24.148.206   TCP 92      Join Connection rfe > 41686 [SYN, ACK] Seq=0 Ack=1 Win=28560 Len=0 MSS=1400 SACK_PERM=1 TSval=492405 TSecr=1836274 WS=128

//then the TCP packet been fraged to 1362 and 6
341 2015-07-13 03:04:12.783125000   10.96.89.180    219.141.250.152 TCP 1450    2199437062  Data Sequence Signal    37253 > rfe [ACK] Seq=147123 Ack=1 Win=58496 Len=1362 TSval=1836354 TSecr=492451
343 2015-07-13 03:04:12.783135000   10.96.89.180    219.141.250.152 TCP 94  2199438424  Data Sequence Signal    37253 > rfe [ACK] Seq=148485 Ack=1 Win=58496 Len=6 TSval=1836354 TSecr=492451

With this fragment,the throughput is bad,so please help to resolve this bug.
Thanks.

**Comment by obonaventure** [comment]
See https://listes-2.sipr.ucl.ac.be/sympa/arc/mptcp-dev/2014-09/msg00116.html and subsequent messages on this list

**Comment by ak47for** [comment]
Thanks for your quick response.
And,please help to check this bug.

Thanks

**Comment by obonaventure** [comment]
On 13/07/15 14:14, 18511320459 wrote:

> Thanks for your quick response.
> And,please help to check this bug.

Try to redo your experiments with mptcp_trunk because the MSS patch was 
not included in v.089 afaik

Olivier
