### ISSUE TITLE
Am i affected by Middlebox ?? cpaasch suggested to use Tracebox (but how do i know ?)

### ISSUE THREAD

**Issue by AnsEMU** [multipath-tcp/mptcp#83]
I am using eth0 and wlan0
These are my results  : 
root@ENES:/home/enes/tracebox# tracebox -n -p IP/TCP/MSS/MPCAPABLE/WSCALE bahn.de
tracebox to 81.200.198.6 (bahn.de): 64 hops max
1: 10.10.0.1  [PARTIAL] 
2: 193.140.41.10 IP::TTL IP::CheckSum 
3: 81.200.198.6 TCP::SrcPort TCP::DstPort TCP::SeqNumber TCP::AckNumber TCP::DataOffset TCP::Flags TCP::CheckSum IP::TotalLength IP::Identification IP::TTL IP::CheckSum IP::SourceIP IP::DestinationIP -TCPOptionMPTCPCapable TCPOptionWindowScale::Shift 
Could not store results on server: Timeout was reached
???
-note: this webpage https://amiusingmptcp.com/  tells me NO !!
-i followed every single step here http://multipath-tcp.org/pmwiki.php/Users/AptRepository with the routing stuff.
But can't identify why MPTCP doesn’t work ???
Help please

**Comment by obonaventure** [comment]
On 31/05/15 23:30, AnsEMU wrote:

> I am using eth0 and wlan0

I suggest that you first try on eth0 to do the following :
- start tcpdump on eth0 (you need a recent version of tcpdump that
  understands MPTCP, wireshark is an alternative)
- do telnet www.multipath-tcp.org 80
- verify in the packet capture if the MP_CAPABLE option was
  set in the SYN segment. If yes, it indicates that MPTCP has been
  installed. If not, check your kernel
- Check in the SYN+ACK segment whether it contains the MP_CAPABLE
  option. If not, then you are behind a proxy or middlebox that blocks MPTCP

If you have issues with tracebox, please post them on
https://github.com/tracebox/tracebox/issues

OB

**Comment by AnsEMU** [comment]
how to do the step after : telnet www.multipath-tcp.org 80    ???

**Comment by obonaventure** [comment]
On 31/05/15 23:46, AnsEMU wrote:

> how to do the step after : telnet www.multipath-tcp.org
> http://www.multipath-tcp.org 80 ???

You can type

GET / HTTP/1.0

but only the SYN segments are important and you will see them in the
tcpdump output

OB

**Comment by AnsEMU** [comment]
here what i did---> in one terminal i wrote : telnet www.multipath-tcp.org 80
in another one : tcpdump -n -i any port 80 
so i got : 
root@ENES:/home/enes# tcpdump -n -i any port 80
tcpdump: verbose output suppressed, use -v or -vv for full protocol decode
listening on any, link-type LINUX_SLL (Linux cooked), capture size 65535 bytes
00:49:02.606324 IP 10.10.0.203.56589 > 185.31.17.130.80: Flags [.], ack 4011085763, win 952, options [nop,nop,TS val 145248 ecr 1843566279], length 0
00:49:02.607309 IP 185.31.17.130.80 > 10.10.0.203.56589: Flags [.], ack 1, win 5422, options [nop,nop,TS val 1843567280 ecr 125215], length 0
00:49:02.926328 IP 10.10.0.203.44494 > 216.58.209.10.80: Flags [.], ack 378464243, win 758, options [nop,nop,TS val 145328 ecr 1843566311], length 0
00:49:02.926555 IP 216.58.209.10.80 > 10.10.0.203.44494: Flags [.], ack 1, win 3216, options [nop,nop,TS val 1843567312 ecr 122794], length 0
00:49:03.022325 IP 10.10.0.203.57793 > 173.194.78.95.80: Flags [.], ack 3925979620, win 251, options [nop,nop,TS val 145352 ecr 1843566320], length 0
00:49:03.022335 IP 10.10.0.203.57794 > 173.194.78.95.80: Flags [.], ack 1173108500, win 240, options [nop,nop,TS val 145352 ecr 1843566320], length 0
00:49:03.022556 IP 173.194.78.95.80 > 10.10.0.203.57793: Flags [.], ack 1, win 3216, options [nop,nop,TS val 1843567322 ecr 122817], length 0
00:49:03.022567 IP 173.194.78.95.80 > 10.10.0.203.57794: Flags [.], ack 1, win 3216, options [nop,nop,TS val 1843567322 ecr 122817], length 0
00:49:03.150327 IP 10.10.0.203.56598 > 185.31.17.130.80: Flags [.], ack 2664454212, win 296, options [nop,nop,TS val 145384 ecr 1843566333], length 0
00:49:03.150550 IP 185.31.17.130.80 > 10.10.0.203.56598: Flags [.], ack 1, win 3267, options [nop,nop,TS val 1843567335 ecr 125354], length 0
00:49:03.246325 IP 10.10.0.203.59503 > 216.58.208.110.80: Flags [.], ack 2801110747, win 237, options [nop,nop,TS val 145408 ecr 1843566343], length 0
00:49:03.249803 IP 216.58.208.110.80 > 10.10.0.203.59503: Flags [.], ack 1, win 5792, options [nop,nop,TS val 1843567345 ecr 125379], length 0
00:49:03.550328 IP 10.10.0.203.56590 > 185.31.17.130.80: Flags [.], ack 3918269091, win 1594, options [nop,nop,TS val 145484 ecr 1843566373], length 0
00:49:03.550647 IP 185.31.17.130.80 > 10.10.0.203.56590: Flags [.], ack 1, win 5595, options [nop,nop,TS val 1843567375 ecr 125454], length 0
00:49:03.822327 IP 10.10.0.203.56597 > 185.31.17.130.80: Flags [.], ack 517787162, win 338, options [nop,nop,TS val 145552 ecr 1843566400], length 0
00:49:03.822988 IP 185.31.17.130.80 > 10.10.0.203.56597: Flags [.], ack 1, win 3216, options [nop,nop,TS val 1843567402 ecr 125522], length 0
00:49:05.486333 IP 10.10.0.203.56600 > 185.31.17.130.80: Flags [.], ack 386210979, win 523, options [nop,nop,TS val 145968 ecr 1843566567], length 0
00:49:05.486556 IP 185.31.17.130.80 > 10.10.0.203.56600: Flags [.], ack 1, win 3550, options [nop,nop,TS val 1843567568 ecr 125936], length 0
00:49:05.870330 IP 10.10.0.203.37526 > 23.235.33.134.80: Flags [.], ack 1020797553, win 335, options [nop,nop,TS val 146064 ecr 1843566605], length 0
00:49:05.870554 IP 23.235.33.134.80 > 10.10.0.203.37526: Flags [.], ack 1, win 5332, options [nop,nop,TS val 1843567607 ecr 126029], length 0
00:49:09.350919 IP 10.10.0.203.35710 > 130.104.230.45.80: Flags [S], seq 1493066402, win 29200, options [mss 1460,sackOK,TS val 146934 ecr 0,nop,wscale 7,mptcp capable csum {0x60e5e3b93eecd86e}], length 0
00:49:09.351232 IP 130.104.230.45.80 > 10.10.0.203.35710: Flags [S.], seq 2098932791, ack 1493066403, win 5792, options [mss 1460,sackOK,TS val 1843567955 ecr 146934,nop,wscale 1], length 0
00:49:09.351248 IP 10.10.0.203.35710 > 130.104.230.45.80: Flags [.], ack 1, win 229, options [nop,nop,TS val 146934 ecr 1843567955], length 0
00:49:12.622328 IP 10.10.0.203.56589 > 185.31.17.130.80: Flags [.], ack 1, win 952, options [nop,nop,TS val 147752 ecr 1843567280], length 0
00:49:12.622759 IP 185.31.17.130.80 > 10.10.0.203.56589: Flags [.], ack 1, win 5422, options [nop,nop,TS val 1843568282 ecr 125215], length 0
00:49:12.942328 IP 10.10.0.203.44494 > 216.58.209.10.80: Flags [.], ack 1, win 758, options [nop,nop,TS val 147832 ecr 1843567312], length 0
00:49:12.942555 IP 216.58.209.10.80 > 10.10.0.203.44494: Flags [.], ack 1, win 3216, options [nop,nop,TS val 1843568314 ecr 122794], length 0
00:49:13.038329 IP 10.10.0.203.57793 > 173.194.78.95.80: Flags [.], ack 1, win 251, options [nop,nop,TS val 147856 ecr 1843567322], length 0
00:49:13.038340 IP 10.10.0.203.57794 > 173.194.78.95.80: Flags [.], ack 1, win 240, options [nop,nop,TS val 147856 ecr 1843567322], length 0
00:49:13.038552 IP 173.194.78.95.80 > 10.10.0.203.57793: Flags [.], ack 1, win 3216, options [nop,nop,TS val 1843568324 ecr 122817], length 0
00:49:13.038563 IP 173.194.78.95.80 > 10.10.0.203.57794: Flags [.], ack 1, win 3216, options [nop,nop,TS val 1843568324 ecr 122817], length 0
00:49:13.166327 IP 10.10.0.203.56598 > 185.31.17.130.80: Flags [.], ack 1, win 296, options [nop,nop,TS val 147888 ecr 1843567335], length 0
00:49:13.167049 IP 185.31.17.130.80 > 10.10.0.203.56598: Flags [.], ack 1, win 3267, options [nop,nop,TS val 1843568336 ecr 125354], length 0
00:49:13.262329 IP 10.10.0.203.59503 > 216.58.208.110.80: Flags [.], ack 1, win 237, options [nop,nop,TS val 147912 ecr 1843567345], length 0
00:49:13.262577 IP 216.58.208.110.80 > 10.10.0.203.59503: Flags [.], ack 1, win 5792, options [nop,nop,TS val 1843568346 ecr 125379], length 0
00:49:13.566331 IP 10.10.0.203.56590 > 185.31.17.130.80: Flags [.], ack 1, win 1594, options [nop,nop,TS val 147988 ecr 1843567375], length 0
00:49:13.566548 IP 185.31.17.130.80 > 10.10.0.203.56590: Flags [.], ack 1, win 5595, options [nop,nop,TS val 1843568376 ecr 125454], length 0
00:49:13.838325 IP 10.10.0.203.56597 > 185.31.17.130.80: Flags [.], ack 1, win 338, options [nop,nop,TS val 148056 ecr 1843567402], length 0
00:49:13.838521 IP 185.31.17.130.80 > 10.10.0.203.56597: Flags [.], ack 1, win 3216, options [nop,nop,TS val 1843568404 ecr 125522], length 0
00:49:14.351591 IP 10.10.0.203.35710 > 130.104.230.45.80: Flags [F.], seq 1, ack 1, win 229, options [nop,nop,TS val 148184 ecr 1843567955], length 0
00:49:14.351867 IP 130.104.230.45.80 > 10.10.0.203.35710: Flags [.], ack 2, win 2896, options [nop,nop,TS val 1843568455 ecr 148184], length 0
00:49:14.351885 IP 130.104.230.45.80 > 10.10.0.203.35710: Flags [F.], seq 1, ack 2, win 2896, options [nop,nop,TS val 1843568455 ecr 148184], length 0
00:49:14.351897 IP 10.10.0.203.35710 > 130.104.230.45.80: Flags [.], ack 2, win 229, options [nop,nop,TS val 148184 ecr 1843568455], length 0
00:49:15.502332 IP 10.10.0.203.56600 > 185.31.17.130.80: Flags [.], ack 1, win 523, options [nop,nop,TS val 148472 ecr 1843567568], length 0
00:49:15.502556 IP 185.31.17.130.80 > 10.10.0.203.56600: Flags [.], ack 1, win 3550, options [nop,nop,TS val 1843568570 ecr 125936], length 0
00:49:15.886328 IP 10.10.0.203.37526 > 23.235.33.134.80: Flags [.], ack 1, win 335, options [nop,nop,TS val 148568 ecr 1843567607], length 0
00:49:15.886558 IP 23.235.33.134.80 > 10.10.0.203.37526: Flags [.], ack 1, win 5332, options [nop,nop,TS val 1843568608 ecr 126029], length 0
00:49:18.336211 IP 130.104.230.45.80 > 10.10.0.203.35709: Flags [F.], seq 1120587448, ack 3846713681, win 2896, options [nop,nop,TS val 1843568853 ecr 143892], length 0
00:49:18.336402 IP 10.10.0.203.35709 > 130.104.230.45.80: Flags [F.], seq 1, ack 1, win 229, options [nop,nop,TS val 149180 ecr 1843568853], length 0
00:49:18.336698 IP 130.104.230.45.80 > 10.10.0.203.35709: Flags [.], ack 2, win 2896, options [nop,nop,TS val 1843568853 ecr 149180], length 0
00:49:22.638335 IP 10.10.0.203.56589 > 185.31.17.130.80: Flags [.], ack 1, win 952, options [nop,nop,TS val 150256 ecr 1843568282], length 0
00:49:22.638624 IP 185.31.17.130.80 > 10.10.0.203.56589: Flags [.], ack 1, win 5422, options [nop,nop,TS val 1843569284 ecr 125215], length 0
00:49:22.958327 IP 10.10.0.203.44494 > 216.58.209.10.80: Flags [.], ack 1, win 758, options [nop,nop,TS val 150336 ecr 1843568314], length 0
00:49:22.958535 IP 216.58.209.10.80 > 10.10.0.203.44494: Flags [.], ack 1, win 3216, options [nop,nop,TS val 1843569316 ecr 122794], length 0
00:49:23.054357 IP 10.10.0.203.57793 > 173.194.78.95.80: Flags [.], ack 1, win 251, options [nop,nop,TS val 150360 ecr 1843568324], length 0
00:49:23.054381 IP 10.10.0.203.57794 > 173.194.78.95.80: Flags [.], ack 1, win 240, options [nop,nop,TS val 150360 ecr 1843568324], length 0
00:49:23.055020 IP 173.194.78.95.80 > 10.10.0.203.57794: Flags [.], ack 1, win 3216, options [nop,nop,TS val 1843569325 ecr 122817], length 0
00:49:23.055047 IP 173.194.78.95.80 > 10.10.0.203.57793: Flags [.], ack 1, win 3216, options [nop,nop,TS val 1843569325 ecr 122817], length 0
00:49:23.182421 IP 10.10.0.203.56598 > 185.31.17.130.80: Flags [.], ack 1, win 296, options [nop,nop,TS val 150392 ecr 1843568336], length 0
00:49:23.182640 IP 185.31.17.130.80 > 10.10.0.203.56598: Flags [.], ack 1, win 3267, options [nop,nop,TS val 1843569338 ecr 125354], length 0
00:49:23.278369 IP 10.10.0.203.59503 > 216.58.208.110.80: Flags [.], ack 1, win 237, options [nop,nop,TS val 150416 ecr 1843568346], length 0
00:49:23.278823 IP 216.58.208.110.80 > 10.10.0.203.59503: Flags [.], ack 1, win 5792, options [nop,nop,TS val 1843569348 ecr 125379], length 0
00:49:23.582353 IP 10.10.0.203.56590 > 185.31.17.130.80: Flags [.], ack 1, win 1594, options [nop,nop,TS val 150492 ecr 1843568376], length 0
00:49:23.582578 IP 185.31.17.130.80 > 10.10.0.203.56590: Flags [.], ack 1, win 5595, options [nop,nop,TS val 1843569378 ecr 125454], length 0
00:49:23.854391 IP 10.10.0.203.56597 > 185.31.17.130.80: Flags [.], ack 1, win 338, options [nop,nop,TS val 150560 ecr 1843568404], length 0
00:49:23.854667 IP 185.31.17.130.80 > 10.10.0.203.56597: Flags [.], ack 1, win 3216, options [nop,nop,TS val 1843569405 ecr 125522], length 0
00:49:25.518337 IP 10.10.0.203.56600 > 185.31.17.130.80: Flags [.], ack 1, win 523, options [nop,nop,TS val 150976 ecr 1843568570], length 0
00:49:25.518550 IP 185.31.17.130.80 > 10.10.0.203.56600: Flags [.], ack 1, win 3550, options [nop,nop,TS val 1843569572 ecr 125936], length 0
00:49:25.902357 IP 10.10.0.203.37526 > 23.235.33.134.80: Flags [.], ack 1, win 335, options [nop,nop,TS val 151072 ecr 1843568608], length 0
00:49:25.902607 IP 23.235.33.134.80 > 10.10.0.203.37526: Flags [.], ack 1, win 5332, options [nop,nop,TS val 1843569610 ecr 126029], length 0
00:49:28.352855 IP 10.10.0.203.44494 > 216.58.209.10.80: Flags [F.], seq 1, ack 1, win 758, options [nop,nop,TS val 151684 ecr 1843569316], length 0
00:49:28.352944 IP 10.10.0.203.57793 > 173.194.78.95.80: Flags [F.], seq 1, ack 1, win 251, options [nop,nop,TS val 151684 ecr 1843569325], length 0
00:49:28.352996 IP 10.10.0.203.57794 > 173.194.78.95.80: Flags [F.], seq 1, ack 1, win 240, options [nop,nop,TS val 151684 ecr 1843569325], length 0
00:49:28.353198 IP 216.58.209.10.80 > 10.10.0.203.44494: Flags [.], ack 2, win 3216, options [nop,nop,TS val 1843569855 ecr 151684], length 0
00:49:28.353242 IP 173.194.78.95.80 > 10.10.0.203.57793: Flags [.], ack 2, win 3216, options [nop,nop,TS val 1843569855 ecr 151684], length 0
00:49:28.353251 IP 216.58.209.10.80 > 10.10.0.203.44494: Flags [F.], seq 1, ack 2, win 3216, options [nop,nop,TS val 1843569855 ecr 151684], length 0
00:49:28.353280 IP 10.10.0.203.44494 > 216.58.209.10.80: Flags [.], ack 2, win 758, options [nop,nop,TS val 151684 ecr 1843569855], length 0
00:49:28.353287 IP 173.194.78.95.80 > 10.10.0.203.57793: Flags [F.], seq 1, ack 2, win 3216, options [nop,nop,TS val 1843569855 ecr 151684], length 0
00:49:28.353295 IP 10.10.0.203.57793 > 173.194.78.95.80: Flags [.], ack 2, win 251, options [nop,nop,TS val 151684 ecr 1843569855], length 0
00:49:28.353300 IP 173.194.78.95.80 > 10.10.0.203.57794: Flags [.], ack 2, win 3216, options [nop,nop,TS val 1843569855 ecr 151684], length 0
00:49:28.353308 IP 173.194.78.95.80 > 10.10.0.203.57794: Flags [F.], seq 1, ack 2, win 3216, options [nop,nop,TS val 1843569855 ecr 151684], length 0
00:49:28.353315 IP 10.10.0.203.57794 > 173.194.78.95.80: Flags [.], ack 2, win 240, options [nop,nop,TS val 151684 ecr 1843569855], length 0
00:49:32.654402 IP 10.10.0.203.56589 > 185.31.17.130.80: Flags [.], ack 1, win 952, options [nop,nop,TS val 152760 ecr 1843569284], length 0
00:49:32.654912 IP 185.31.17.130.80 > 10.10.0.203.56589: Flags [.], ack 1, win 5422, options [nop,nop,TS val 1843570285 ecr 125215], length 0
00:49:33.198375 IP 10.10.0.203.56598 > 185.31.17.130.80: Flags [.], ack 1, win 296, options [nop,nop,TS val 152896 ecr 1843569338], length 0
00:49:33.223255 IP 185.31.17.130.80 > 10.10.0.203.56598: Flags [.], ack 1, win 3267, options [nop,nop,TS val 1843570342 ecr 125354], length 0
00:49:33.294391 IP 10.10.0.203.59503 > 216.58.208.110.80: Flags [.], ack 1, win 237, options [nop,nop,TS val 152920 ecr 1843569348], length 0
00:49:33.331923 IP 216.58.208.110.80 > 10.10.0.203.59503: Flags [.], ack 1, win 5792, options [nop,nop,TS val 1843570353 ecr 125379], length 0
00:49:33.598412 IP 10.10.0.203.56590 > 185.31.17.130.80: Flags [.], ack 1, win 1594, options [nop,nop,TS val 152996 ecr 1843569378], length 0
00:49:33.598640 IP 185.31.17.130.80 > 10.10.0.203.56590: Flags [.], ack 1, win 5595, options [nop,nop,TS val 1843570380 ecr 125454], length 0
00:49:33.870420 IP 10.10.0.203.56597 > 185.31.17.130.80: Flags [.], ack 1, win 338, options [nop,nop,TS val 153064 ecr 1843569405], length 0
00:49:33.870658 IP 185.31.17.130.80 > 10.10.0.203.56597: Flags [.], ack 1, win 3216, options [nop,nop,TS val 1843570407 ecr 125522], length 0
00:49:35.534403 IP 10.10.0.203.56600 > 185.31.17.130.80: Flags [.], ack 1, win 523, options [nop,nop,TS val 153480 ecr 1843569572], length 0
00:49:35.534699 IP 185.31.17.130.80 > 10.10.0.203.56600: Flags [.], ack 1, win 3550, options [nop,nop,TS val 1843570573 ecr 125936], length 0
00:49:35.918358 IP 10.10.0.203.37526 > 23.235.33.134.80: Flags [.], ack 1, win 335, options [nop,nop,TS val 153576 ecr 1843569610], length 0
00:49:35.918592 IP 23.235.33.134.80 > 10.10.0.203.37526: Flags [.], ack 1, win 5332, options [nop,nop,TS val 1843570612 ecr 126029], length 0
00:49:38.352748 IP 10.10.0.203.56589 > 185.31.17.130.80: Flags [F.], seq 1, ack 1, win 952, options [nop,nop,TS val 154184 ecr 1843570285], length 0
00:49:38.352779 IP 10.10.0.203.59503 > 216.58.208.110.80: Flags [F.], seq 1, ack 1, win 237, options [nop,nop,TS val 154184 ecr 1843570353], length 0
00:49:38.352792 IP 10.10.0.203.56598 > 185.31.17.130.80: Flags [F.], seq 1, ack 1, win 296, options [nop,nop,TS val 154184 ecr 1843570342], length 0
00:49:38.353029 IP 185.31.17.130.80 > 10.10.0.203.56589: Flags [.], ack 2, win 5422, options [nop,nop,TS val 1843570855 ecr 154184], length 0
00:49:38.353074 IP 185.31.17.130.80 > 10.10.0.203.56598: Flags [.], ack 2, win 3267, options [nop,nop,TS val 1843570855 ecr 154184], length 0
00:49:38.353084 IP 185.31.17.130.80 > 10.10.0.203.56589: Flags [F.], seq 1, ack 2, win 5422, options [nop,nop,TS val 1843570855 ecr 154184], length 0
00:49:38.353113 IP 10.10.0.203.56589 > 185.31.17.130.80: Flags [.], ack 2, win 952, options [nop,nop,TS val 154184 ecr 1843570855], length 0
00:49:38.353121 IP 216.58.208.110.80 > 10.10.0.203.59503: Flags [.], ack 2, win 5792, options [nop,nop,TS val 1843570855 ecr 154184], length 0
00:49:38.353129 IP 185.31.17.130.80 > 10.10.0.203.56598: Flags [F.], seq 1, ack 2, win 3267, options [nop,nop,TS val 1843570855 ecr 154184], length 0
00:49:38.353137 IP 10.10.0.203.56598 > 185.31.17.130.80: Flags [.], ack 2, win 296, options [nop,nop,TS val 154184 ecr 1843570855], length 0
00:49:38.353141 IP 216.58.208.110.80 > 10.10.0.203.59503: Flags [F.], seq 1, ack 2, win 5792, options [nop,nop,TS val 1843570855 ecr 154184], length 0
00:49:38.353148 IP 10.10.0.203.59503 > 216.58.208.110.80: Flags [.], ack 2, win 237, options [nop,nop,TS val 154184 ecr 1843570855], length 0
00:49:39.353080 IP 10.10.0.203.56597 > 185.31.17.130.80: Flags [F.], seq 1, ack 1, win 338, options [nop,nop,TS val 154434 ecr 1843570407], length 0
00:49:39.353156 IP 10.10.0.203.56590 > 185.31.17.130.80: Flags [F.], seq 1, ack 1, win 1594, options [nop,nop,TS val 154434 ecr 1843570380], length 0
00:49:39.353409 IP 185.31.17.130.80 > 10.10.0.203.56597: Flags [.], ack 2, win 3216, options [nop,nop,TS val 1843570955 ecr 154434], length 0
00:49:39.353457 IP 185.31.17.130.80 > 10.10.0.203.56597: Flags [F.], seq 1, ack 2, win 3216, options [nop,nop,TS val 1843570955 ecr 154434], length 0
00:49:39.353488 IP 10.10.0.203.56597 > 185.31.17.130.80: Flags [.], ack 2, win 338, options [nop,nop,TS val 154434 ecr 1843570955], length 0
00:49:39.353497 IP 185.31.17.130.80 > 10.10.0.203.56590: Flags [.], ack 2, win 5595, options [nop,nop,TS val 1843570955 ecr 154434], length 0
00:49:39.353509 IP 185.31.17.130.80 > 10.10.0.203.56590: Flags [F.], seq 1, ack 2, win 5595, options [nop,nop,TS val 1843570955 ecr 154434], length 0
00:49:39.353517 IP 10.10.0.203.56590 > 185.31.17.130.80: Flags [.], ack 2, win 1594, options [nop,nop,TS val 154434 ecr 1843570955], length 0
00:49:41.354090 IP 10.10.0.203.37526 > 23.235.33.134.80: Flags [F.], seq 1, ack 1, win 335, options [nop,nop,TS val 154934 ecr 1843570612], length 0
00:49:41.354180 IP 10.10.0.203.56600 > 185.31.17.130.80: Flags [F.], seq 1, ack 1, win 523, options [nop,nop,TS val 154934 ecr 1843570573], length 0
00:49:41.354373 IP 23.235.33.134.80 > 10.10.0.203.37526: Flags [.], ack 2, win 5332, options [nop,nop,TS val 1843571155 ecr 154934], length 0
00:49:41.354429 IP 23.235.33.134.80 > 10.10.0.203.37526: Flags [F.], seq 1, ack 2, win 5332, options [nop,nop,TS val 1843571155 ecr 154934], length 0
00:49:41.354473 IP 10.10.0.203.37526 > 23.235.33.134.80: Flags [.], ack 2, win 335, options [nop,nop,TS val 154935 ecr 1843571155], length 0
00:49:41.354484 IP 185.31.17.130.80 > 10.10.0.203.56600: Flags [.], ack 2, win 3550, options [nop,nop,TS val 1843571155 ecr 154934], length 0
00:49:41.354498 IP 185.31.17.130.80 > 10.10.0.203.56600: Flags [F.], seq 1, ack 2, win 3550, options [nop,nop,TS val 1843571155 ecr 154934], length 0
00:49:41.354519 IP 10.10.0.203.56600 > 185.31.17.130.80: Flags [.], ack 2, win 523, options [nop,nop,TS val 154935 ecr 1843571155], length 0
^Z
[1]+  Stopped                 tcpdump -n -i any port 80
root@ENES:/home/enes#

**Comment by AnsEMU** [comment]
what is the command for tcpdump out ???

**Comment by AnsEMU** [comment]
these are the results when i connect to ftp.multipath-tcp.org and download 1GB : 
root@ENES:/home/enes# tcpdump -c 50 -i eth0
tcpdump: verbose output suppressed, use -v or -vv for full protocol decode
listening on eth0, link-type EN10MB (Ethernet), capture size 65535 bytes
01:18:25.112712 ARP, Request who-has 10.10.0.141 tell 10.10.0.219, length 46
01:18:25.113879 ARP, Request who-has 10.10.1.189 tell 10.10.1.93, length 46
01:18:25.122463 IP mptcp.info.ucl.ac.be.49999 > 10.10.0.203.49101: Flags [.], seq 4254795775:4254798511, ack 1152864243, win 227, options [nop,nop,TS val 207497627 ecr 585859], length 2736
01:18:25.122548 IP 10.10.0.203.49101 > mptcp.info.ucl.ac.be.49999: Flags [.], ack 2736, win 42698, options [nop,nop,TS val 585877 ecr 207497620], length 0
01:18:25.122645 IP mptcp.info.ucl.ac.be.49999 > 10.10.0.203.49101: Flags [.], seq 2736:4104, ack 1, win 227, options [nop,nop,TS val 207497627 ecr 585859], length 1368
01:18:25.122763 IP mptcp.info.ucl.ac.be.49999 > 10.10.0.203.49101: Flags [.], seq 4104:5472, ack 1, win 227, options [nop,nop,TS val 207497627 ecr 585859], length 1368
01:18:25.122791 IP 10.10.0.203.49101 > mptcp.info.ucl.ac.be.49999: Flags [.], ack 5472, win 42966, options [nop,nop,TS val 585877 ecr 207497627], length 0
01:18:25.126051 IP 10.10.1.172.57187 > 255.255.255.255.2008: UDP, length 13
01:18:25.126099 IP 10.10.1.172.57187 > 255.255.255.255.2007: UDP, length 13
01:18:25.132929 ARP, Request who-has 10.10.0.143 tell 10.10.0.219, length 46
01:18:25.134167 ARP, Request who-has 10.10.1.122 tell 10.10.1.63, length 46
01:18:25.137685 IP mptcp.info.ucl.ac.be.49999 > 10.10.0.203.49101: Flags [.], seq 5472:8208, ack 1, win 227, options [nop,nop,TS val 207497631 ecr 585863], length 2736
01:18:25.137807 IP 10.10.0.203.49101 > mptcp.info.ucl.ac.be.49999: Flags [.], ack 8208, win 42966, options [nop,nop,TS val 585880 ecr 207497631], length 0
01:18:25.139729 IP mptcp.info.ucl.ac.be.49999 > 10.10.0.203.49101: Flags [.], seq 8208:9576, ack 1, win 227, options [nop,nop,TS val 207497632 ecr 585863], length 1368
01:18:25.139845 IP mptcp.info.ucl.ac.be.49999 > 10.10.0.203.49101: Flags [.], seq 9576:10944, ack 1, win 227, options [nop,nop,TS val 207497632 ecr 585863], length 1368
01:18:25.139868 IP 10.10.0.203.49101 > mptcp.info.ucl.ac.be.49999: Flags [.], ack 10944, win 42966, options [nop,nop,TS val 585881 ecr 207497632], length 0
01:18:25.139968 IP mptcp.info.ucl.ac.be.49999 > 10.10.0.203.49101: Flags [.], seq 10944:12312, ack 1, win 227, options [nop,nop,TS val 207497632 ecr 585863], length 1368
01:18:25.140093 IP mptcp.info.ucl.ac.be.49999 > 10.10.0.203.49101: Flags [.], seq 12312:13680, ack 1, win 227, options [nop,nop,TS val 207497632 ecr 585863], length 1368
01:18:25.140110 IP 10.10.0.203.49101 > mptcp.info.ucl.ac.be.49999: Flags [.], ack 13680, win 42966, options [nop,nop,TS val 585881 ecr 207497632], length 0
01:18:25.140317 IP mptcp.info.ucl.ac.be.49999 > 10.10.0.203.49101: Flags [.], seq 13680:16416, ack 1, win 227, options [nop,nop,TS val 207497632 ecr 585863], length 2736
01:18:25.140376 IP 10.10.0.203.49101 > mptcp.info.ucl.ac.be.49999: Flags [.], ack 16416, win 42966, options [nop,nop,TS val 585881 ecr 207497632], length 0
01:18:25.140565 IP mptcp.info.ucl.ac.be.49999 > 10.10.0.203.49101: Flags [.], seq 16416:17784, ack 1, win 227, options [nop,nop,TS val 207497632 ecr 585863], length 1368
01:18:25.140846 IP mptcp.info.ucl.ac.be.49999 > 10.10.0.203.49101: Flags [P.], seq 17784:19152, ack 1, win 227, options [nop,nop,TS val 207497632 ecr 585863], length 1368
01:18:25.140866 IP 10.10.0.203.49101 > mptcp.info.ucl.ac.be.49999: Flags [.], ack 19152, win 42966, options [nop,nop,TS val 585881 ecr 207497632], length 0
01:18:25.141917 ARP, Request who-has 10.10.0.1 tell 10.10.0.249, length 46
01:18:25.142823 ARP, Request who-has 10.10.0.144 tell 10.10.0.219, length 46
01:18:25.161879 IP mptcp.info.ucl.ac.be.49999 > 10.10.0.203.49101: Flags [.], seq 19152:21888, ack 1, win 227, options [nop,nop,TS val 207497637 ecr 585869], length 2736
01:18:25.161978 IP 10.10.0.203.49101 > mptcp.info.ucl.ac.be.49999: Flags [.], ack 21888, win 42966, options [nop,nop,TS val 585886 ecr 207497637], length 0
01:18:25.162003 IP mptcp.info.ucl.ac.be.49999 > 10.10.0.203.49101: Flags [.], seq 21888:23256, ack 1, win 227, options [nop,nop,TS val 207497637 ecr 585869], length 1368
01:18:25.162254 IP mptcp.info.ucl.ac.be.49999 > 10.10.0.203.49101: Flags [.], seq 23256:24624, ack 1, win 227, options [nop,nop,TS val 207497637 ecr 585869], length 1368
01:18:25.162266 IP 10.10.0.203.49101 > mptcp.info.ucl.ac.be.49999: Flags [.], ack 24624, win 42966, options [nop,nop,TS val 585886 ecr 207497637], length 0
01:18:25.162357 IP mptcp.info.ucl.ac.be.49999 > 10.10.0.203.49101: Flags [.], seq 24624:25992, ack 1, win 227, options [nop,nop,TS val 207497637 ecr 585869], length 1368
01:18:25.162532 IP mptcp.info.ucl.ac.be.49999 > 10.10.0.203.49101: Flags [.], seq 25992:27360, ack 1, win 227, options [nop,nop,TS val 207497637 ecr 585869], length 1368
01:18:25.162567 IP 10.10.0.203.49101 > mptcp.info.ucl.ac.be.49999: Flags [.], ack 27360, win 42966, options [nop,nop,TS val 585887 ecr 207497637], length 0
01:18:25.176318 ARP, Request who-has 10.10.0.147 tell 10.10.0.219, length 46
01:18:25.178919 ARP, Request who-has 10.10.1.152 tell 10.10.1.138, length 46
01:18:25.179566 ARP, Request who-has 10.10.1.153 tell 10.10.1.138, length 46
01:18:25.186101 ARP, Request who-has 10.10.0.148 tell 10.10.0.219, length 46
01:18:25.190999 IP 10.10.1.142.57952 > 255.255.255.255.2008: UDP, length 30
01:18:25.191044 IP 10.10.1.142.57952 > 255.255.255.255.2007: UDP, length 30
01:18:25.191708 IP mptcp.info.ucl.ac.be.49999 > 10.10.0.203.49101: Flags [.], seq 27360:28728, ack 1, win 227, options [nop,nop,TS val 207497645 ecr 585877], length 1368
01:18:25.191840 IP mptcp.info.ucl.ac.be.49999 > 10.10.0.203.49101: Flags [.], seq 28728:30096, ack 1, win 227, options [nop,nop,TS val 207497645 ecr 585877], length 1368
01:18:25.191860 IP 10.10.0.203.49101 > mptcp.info.ucl.ac.be.49999: Flags [.], ack 30096, win 42966, options [nop,nop,TS val 585894 ecr 207497645], length 0
01:18:25.192006 IP mptcp.info.ucl.ac.be.49999 > 10.10.0.203.49101: Flags [.], seq 30096:31464, ack 1, win 227, options [nop,nop,TS val 207497645 ecr 585877], length 1368
01:18:25.192176 IP mptcp.info.ucl.ac.be.49999 > 10.10.0.203.49101: Flags [.], seq 31464:32832, ack 1, win 227, options [nop,nop,TS val 207497645 ecr 585877], length 1368
01:18:25.192211 IP 10.10.0.203.49101 > mptcp.info.ucl.ac.be.49999: Flags [.], ack 32832, win 42966, options [nop,nop,TS val 585894 ecr 207497645], length 0
01:18:25.192469 IP6 fe80::2505:58ec:1efa:a81f.dhcpv6-client > ff02::1:2.dhcpv6-server: dhcp6 solicit
01:18:25.195957 ARP, Request who-has 10.10.0.149 tell 10.10.0.219, length 46
01:18:25.205859 ARP, Request who-has 10.10.0.150 tell 10.10.0.219, length 46
01:18:25.206458 IP mptcp.info.ucl.ac.be.49999 > 10.10.0.203.49101: Flags [.], seq 32832:35568, ack 1, win 227, options [nop,nop,TS val 207497648 ecr 585880], length 2736
50 packets captured
1770 packets received by filter
0 packets dropped by kernel
root@ENES:/home/enes# 

nothing such MP_CAPABLE !! any further help ??

**Comment by obonaventure** [comment]
On 31/05/15 23:30, AnsEMU wrote:

> I am using eth0 and wlan0
> These are my results :
> root@ENES:/home/enes/tracebox# tracebox -n -p
> IP/TCP/MSS/MPCAPABLE/WSCALE bahn.de
> tracebox to 81.200.198.6 (bahn.de): 64 hops max
> 1: 10.10.0.1 [PARTIAL]
> 2: 193.140.41.10 IP::TTL IP::CheckSum
> 3: 81.200.198.6 TCP::SrcPort TCP::DstPort TCP::SeqNumber TCP::AckNumber
> TCP::DataOffset TCP::Flags TCP::CheckSum IP::TotalLength
> IP::Identification IP::TTL IP::CheckSum IP::SourceIP IP::DestinationIP
> -TCPOptionMPTCPCapable TCPOptionWindowScale::Shift

You have a proxy on your path because you receive the answer at the
third hop while the destination is farther in the network.

You should try

tracebox -n -p IP/TCP/MSS/MPCAPABLE multipath-tcp.org

Apparently, 193.140.41.10 belongs to a university, you should contact
your network administrator to see the type of firewall that they have
deployed

**Comment by obonaventure** [comment]
Hello,

> here what i did---> in one terminal i wrote : telnet
> www.multipath-tcp.org http://www.multipath-tcp.org 80
> in another one : tcpdump -n -i any port 80
> so i got :
> root@ENES:/home/enes# tcpdump -n -i any port 80
> tcpdump: verbose output suppressed, use -v or -vv for full protocol decode
> listening on any, link-type LINUX_SLL (Linux cooked), capture size 65535
> bytes
> 00:49:02.606324 IP 10.10.0.203.56589 > 185.31.17.130.80: Flags [.], ack
> 4011085763, win 952, options [nop,nop,TS val 145248 ecr 1843566279],
> length 0

It seems that the kernel that you use is not mptcp capable

OB

**Comment by cpaasch** [comment]
Closing
