### ISSUE TITLE
IPv4+IPv6 with "fullmesh" PM: not all IPv6 subflows are established

### ISSUE THREAD

**Issue by dreibh** [multipath-tcp/mptcp#134]
I have two machines, both with MPTCP kernel based on upstream/mptcp_v0.91 (i.e. the latest version). The machines are part of the NorNet testbed (see https://www.nntb.no/), using NetPerfMeter (https://www.uni-due.de/~be0001/netperfmeter/) for the tests.

Machine 1:
   eth0:     10.1.6.115   10.8.6.115
             2001:700:4100:106::73:67
             2001:700:4100:806::73:67

Machine 2:
   eth0:     10.1.7.115   10.9.7.115
             2001:700:4100:107::73:69
             2001:700:4100:907::73:69

An MPTCP connection is established from Machine 1 to Machine 2.

Case 1: "fullmesh" with IPv4 only (IPv4 socket, server socket bound to 0.0.0.0, connect() via IPv4 address):

  6   0.029688   10.8.6.115 -> 10.1.7.115   TCP 86 12999→52675 [SYN, ACK] Seq=0 Ack=1 Win=28560 Len=0 MSS=1460 SACK_PERM=1 TSval=716586076 TSecr=432743462 WS=256
 21   0.058943   10.1.6.115 -> 10.1.7.115   TCP 90 12999→46440 [SYN, ACK] Seq=0 Ack=1 Win=28560 Len=0 MSS=1460 SACK_PERM=1 TSval=716586105 TSecr=432743492 WS=256
 24   0.072264   10.8.6.115 -> 10.9.7.115   TCP 90 12999→43722 [SYN, ACK] Seq=0 Ack=1 Win=28560 Len=0 MSS=1460 SACK_PERM=1 TSval=716586113 TSecr=432743492 WS=256
 26   0.074227   10.1.6.115 -> 10.9.7.115   TCP 90 12999→47506 [SYN, ACK] Seq=0 Ack=1 Win=28560 Len=0 MSS=1460 SACK_PERM=1 TSval=716586116 TSecr=432743492 WS=256

 This is fine.

Case 2: "fullmesh" with IPv6 only (IPv6 socket, server socket bound to :: + setsockopt IPV6_V6ONLY, connect() via IPv6 address):

  6   0.101479 2001:700:4100:806::73:67 -> 2001:700:4100:907::73:69 TCP 106 13299→58795 [SYN, ACK] Seq=0 Ack=1 Win=28160 Len=0 MSS=1440 SACK_PERM=1 TSval=716950229 TSecr=433107604 WS=256[Packet size limited during capture]
 20   0.177384 2001:700:4100:106::73:67 -> 2001:700:4100:107::73:69 TCP 110 13299→34854 [SYN, ACK] Seq=0 Ack=1 Win=28160 Len=0 MSS=1440 SACK_PERM=1 TSval=716950312 TSecr=433107698 WS=256[Packet size limited during capture]
 22   0.177725 2001:700:4100:806::73:67 -> 2001:700:4100:107::73:69 TCP 110 13299→33335 [SYN, ACK] Seq=0 Ack=1 Win=28160 Len=0 MSS=1440 SACK_PERM=1 TSval=716950312 TSecr=433107698 WS=256[Packet size limited during capture]
 26   0.192207 2001:700:4100:106::73:67 -> 2001:700:4100:907::73:69 TCP 110 13299→49571 [SYN, ACK] Seq=0 Ack=1 Win=28160 Len=0 MSS=1440 SACK_PERM=1 TSval=716950321 TSecr=433107698 WS=256[Packet size limited during capture]

  This is fine as well.

Case 3: "fullmesh" with IPv4+IPv6 (IPv6 socket, server socket bound to ::, connect() via IPv6 address):

 41  71.530639 2001:700:4100:806::73:67 -> 2001:700:4100:907::73:69 TCP 106 13599→36623 [SYN, ACK] Seq=0 Ack=1 Win=27040 Len=0 MSS=1384 SACK_PERM=1 TSval=717404449 TSecr=433561826 WS=256[Packet size limited during capture]
 58  71.607359 2001:700:4100:806::73:67 -> 2001:700:4100:107::73:69 TCP 110 13599→41448 [SYN, ACK] Seq=0 Ack=1 Win=27200 Len=0 MSS=1392 SACK_PERM=1 TSval=717404532 TSecr=433561919 WS=256[Packet size limited during capture]
 60  71.608254   10.1.6.115 -> 10.1.7.115   TCP 90 13599→49312 [SYN, ACK] Seq=0 Ack=1 Win=28560 Len=0 MSS=1460 SACK_PERM=1 TSval=717404533 TSecr=433561919 WS=256
 62  71.608354   10.8.6.115 -> 10.1.7.115   TCP 90 13599→43857 [SYN, ACK] Seq=0 Ack=1 Win=28560 Len=0 MSS=1460 SACK_PERM=1 TSval=717404533 TSecr=433561919 WS=256
 67  71.621289   10.1.6.115 -> 10.9.7.115   TCP 90 13599→54094 [SYN, ACK] Seq=0 Ack=1 Win=28560 Len=0 MSS=1460 SACK_PERM=1 TSval=717404541 TSecr=433561919 WS=256
 69  71.624456   10.8.6.115 -> 10.9.7.115   TCP 90 13599→59781 [SYN, ACK] Seq=0 Ack=1 Win=28560 Len=0 MSS=1460 SACK_PERM=1 TSval=717404543 TSecr=433561919 WS=256

 IPv6 subflows are only established from one of Machine 1's IPv6 addresses to both of Machine 2's IPv6 addresses. The subflows from Machine 1's other IPv6 address are missing.

**Comment by dreibh** [comment]
The attached file contains a pcap trace:
[mptcp-fullmesh-issue.zip](https://github.com/multipath-tcp/mptcp/files/430042/mptcp-fullmesh-issue.zip)

**Comment by dreibh** [comment]
The problem seems to be that both sides only announce their IPv4 addresses. There are only MPTCP_SUB_ADD_ADDR options with the IPv4 addresses in the trace.

**Comment by dreibh** [comment]
Starting the connection via connect() to an IPv4 address, a trace also shows an MPTCP_SUB_ADD_ADDR with IPv6 address. Could it be possible that only one IPv6 address is used in IPv4+IPv6 cases (the IPv6-only case is fine, however)?

[mptcp-fullmesh-issue-via-ipv4.pcap.zip](https://github.com/multipath-tcp/mptcp/files/430128/mptcp-fullmesh-issue-via-ipv4.pcap.zip)

**Comment by cpaasch** [comment]
Can you run `cat /proc/net/mptcp_fullmesh` on the server and show us the output? All IPv6 addresses should be displayed there.

**Comment by dreibh** [comment]
On the server (Machine 2):
Index, Address-ID, Backup, IP-address
IPv4, next v4-index: 3
1, 2, 0, 10.1.7.115
2, 3, 0, 10.9.7.115
IPv6, next v6-index: 2
0, 8, 0, 2001:0700:4100:0107:0000:0000:0073:0069
1, 9, 0, 2001:0700:4100:0907:0000:0000:0073:0069

On the client (Machine 1):
Index, Address-ID, Backup, IP-address
IPv4, next v4-index: 3
1, 2, 0, 10.1.6.115
2, 3, 0, 10.8.6.115
IPv6, next v6-index: 2
0, 8, 0, 2001:0700:4100:0106:0000:0000:0073:0067
1, 9, 0, 2001:0700:4100:0806:0000:0000:0073:0067

So, MPTCP seems to correctly list all IPv4 and IPv6 addresses of each machine.

**Comment by zofon** [comment]
Hi, I notice that

Here is Server node:
hu_zhoufeng@sverresborg.uib.nornet $ cat /proc/net/mptcp_fullmesh
Index, Address-ID, Backup, IP-address
IPv4, next v4-index: 3
1, 2, 0, 10.1.6.178
2, 3, 0, 10.8.6.178
IPv6, next v6-index: 2
0, 8, 0, 2001:0700:4100:0106:0000:0000:00b2:0069 (used)
1, 9, 0, 2001:0700:4100:0806:0000:0000:00b2:0069

This is cilent node:
hu_zhoufeng@rennesoey.uis.nornet $ cat /proc/net/mptcp_fullmesh
Index, Address-ID, Backup, IP-address
IPv4, next v4-index: 4
1, 2, 0, 10.1.5.168
2, 3, 0, 10.11.5.168
3, 4, 0, 10.9.5.168
IPv6, next v6-index: 3
0, 8, 0, 2001:0700:4100:0105:0000:0000:00a8:0068
1, 9, 0, 2001:0700:4100:0b05:0000:0000:00a8:0068
2, 10, 0, 2001:0700:4100:0905:0000:0000:00a8:0068

  5   0.013563 2001:700:4100:105::a8:68 -> 2001:700:4100:106::b2:69 TCP 106 52457→8999 [SYN] Seq=0 Win=28240 Len=0 MSS=1412 SACK_PERM=1 TSval=685605738 TSecr=0 WS=4
 20   0.033912   10.1.5.168 -> 10.1.6.178   TCP 86 41529→8999 [SYN] Seq=0 Win=29200 Len=0 MSS=1460 SACK_PERM=1 TSval=685605758 TSecr=0 WS=4
 21   0.033990  10.11.5.168 -> 10.1.6.178   TCP 86 41523→8999 [SYN] Seq=0 Win=29200 Len=0 MSS=1460 SACK_PERM=1 TSval=685605758 TSecr=0 WS=4
 22   0.034056   10.9.5.168 -> 10.1.6.178   TCP 86 43621→8999 [SYN] Seq=0 Win=29200 Len=0 MSS=1460 SACK_PERM=1 TSval=685605758 TSecr=0 WS=4
 23   0.034131   10.1.5.168 -> 10.8.6.178   TCP 86 53375→8999 [SYN] Seq=0 Win=29200 Len=0 MSS=1460 SACK_PERM=1 TSval=685605758 TSecr=0 WS=4
 24   0.034217  10.11.5.168 -> 10.8.6.178   TCP 86 41831→8999 [SYN] Seq=0 Win=29200 Len=0 MSS=1460 SACK_PERM=1 TSval=685605758 TSecr=0 WS=4

**Comment by dreibh** [comment]
I just noticed that all outputs of /proc/net/mptcp_fullmesh show Index=0 for the first IPv6 address, but Index=1 for the first IPv4 address. This seems to be the case for all of my machines, also for systems with just a single IPv4 address.

I tried to find a reason for this allocation in mptcp_fullmesh.c, but I cannot see a reason why the first IPv4 index is 1, while it is 0 for IPv6. The code for IPv4 and IPv6 handling looks similar.

**Comment by dreibh** [comment]
This is likely the reason: in mptcp_address_worker()
...
        if (event->family == AF_INET) {
...
            mptcp_local->locaddr4[i].loc4_id = i + 1;
...
        } else {
...
            mptcp_local->locaddr6[i].loc6_id = i + MPTCP_MAX_ADDR;
...
        }

I am not sure whether this is related to the subflow establishment issue, however. May be this is completely unrelated.

**Comment by dreibh** [comment]
The code above is for the ID, not for the index. But should the ID setting for IPv6 not be  "i + 1 + MPTCP_MAX_ADDR;" (or "i" for IPv4)? If all MPTCP_MAX_ADDR=8 IPv4 addresses are used, their IDs will be 1, 2, 3, 4, 5, 6, 7 ,8. If index 0 is valid for IPv6, the first IPv6 address's ID will be 8 -> overlap.

**Comment by cpaasch** [comment]
I'm having a fix in the works. Will submit soon.

**Comment by matttbe** [comment]
Fixed in both mptcp_trunk and mptcp_v0.91 branches! Closing this ticket then.
