### ISSUE TITLE
Badopt when announcing IPv4 address on client-side

### ISSUE THREAD

**Issue by cpaasch** [multipath-tcp/mptcp#59]
```
17:26:51.595275 IP 130.104.228.20.57240 > 17.130.16.4.443: Flags [.], ack 1, win 229, options [mptcp add-addr id 2 10.0.3.1,mptcp dss ack 718081163,[bad opt]>
        0x0000:  4510 004c 2ade 4000 4006 87bb 8268 e414
        0x0010:  1182 1004 df98 01bb 4e16 94ee 5c89 268b
        0x0020:  e010 00e5 8841 0000 1e08 3402 0a00 0301
        0x0030:  1e08 2001 2acd 0c8b 6f77 2e6c 6f63 6174
        0x0040:  696f 6e00 0700 0000 0000 0000
```

Strange... Seems to be related to the fact that timestamps have not been negotiated.

**Comment by obonaventure** [comment]
This appeared also in the trace sent by Lior on the mailing list where timestamp was disabled as well

11:00:42.829388 PPPoE  [ses 0x3] IP (tos 0x0, ttl 64, id 8060, offset 0, flags [
DF], proto TCP (6), length 56)
    10.131.1.3.50345 > 192.168.251.214.9999: Flags [.], cksum 0x703a (correct),
seq 1, ack 1, win 29040, options [mp addaddr  vers:0 addrid:1[bad opt]
        0x0000:  0011 6901 80b5 0002 b642 5946 8864 1100
        0x0010:  0003 003a 0021 4500 0038 1f7c 4000 4006
        0x0020:  533f 0a83 0103 c0a8 fbd6 c4a9 270f ae17
        0x0030:  4554 24a0 8ef3 9010 7170 703a 0000 1e08
        0x0040:  3401 0a83 0104 1e08 2001 b61c e1a5
11:00:42.829393 PPPoE  [ses 0x3] IP (tos 0x0, ttl 64, id 8061, offset 0, flags [
DF], proto TCP (6), length 56)
    10.131.1.3.50345 > 192.168.251.214.9999: Flags [.], cksum 0xbaed (correct), seq 1, ack 1, win 29040, options [mp addaddr  vers:0 addrid:2[bad opt]
        0x0000:  0011 6901 80b5 0002 b642 5946 8864 1100
        0x0010:  0003 003a 0021 4500 0038 1f7d 4000 4006
        0x0020:  533e 0a83 0103 c0a8 fbd6 c4a9 270f ae17
        0x0030:  4554 24a0 8ef3 9010 7170 baed 0000 1e08
        0x0040:  3402 c0a8 002a 1e08 2001 b61c e1a5

**Comment by cpaasch** [comment]
Seen it (at least) once in v0.89.1.
Could not reproduce in v0.89.2 nor mptcp_trunk (872d7f6c6f4e). Tried disabling timestamps and checksum as well.

**Comment by gdetal** [comment]
FYI, I tried to reproduce without any luck too.

**Comment by cpaasch** [comment]
@obonaventure : In Lior's trace it is different, because there the option is actually correct. It's just that the  tcpdump in OSX does not correctly parse ADD_ADDR options and always produces a "bad opt". In Linux's tcpdump the ADD_ADDR in Lior's trace looks correct.

**Comment by obonaventure** [comment]
I should stop using Apple or maybe will have to wait for an upgrade of tcpdump from Cupertino...

**Comment by gdetal** [comment]
@obonaventure you can use [homebrew](http://brew.sh/)  to install the regular tcpdump version:

$ brew tap homebrew/dupes
$ brew install tcpdump

tcpdump should be available in /usr/local/sbin

**Comment by cpaasch** [comment]
Closing as nobody has ever seen this again.
